[
  {
    "id": "dcb5cb58-1375-4fa3-a010-3df33f0fbb1a",
    "name": "project_test_runner",
    "version": "1.0.0",
    "description": "Runs the Project DNA test suite using bun test. Supports filtering by file pattern, test name, bail-on-first-failure, and custom timeout. Returns structured pass/fail results with duration and error details.",
    "entrypoint": "src/project_test_runner.ts",
    "testFile": "tests/project_test_runner.test.ts",
    "status": "ACTIVE",
    "parameters": {
      "filePattern": "Glob pattern to match test files (e.g. 'memory-store'). If omitted, runs all tests.",
      "testName": "Substring to filter test names (passed as --test-name-pattern).",
      "bail": "If true, stop on first test failure.",
      "timeout": "Timeout in milliseconds (default: 60000).",
      "verbose": "If true, pass --verbose to show individual test results."
    },
    "telemetry": {
      "totalInvocations": 5,
      "successCount": 3,
      "failureCount": 2,
      "avgDurationMs": 444,
      "healthScore": 0.6,
      "lastExecutedAt": "2026-09-11T19:05:51.753Z"
    },
    "createdAt": "2026-09-10T11:56:18.900Z",
    "updatedAt": "2026-09-11T19:05:51.753Z"
  },
  {
    "id": "fc77c1d6-bba1-48f9-a90a-015526125895",
    "name": "system_info",
    "version": "1.0.0",
    "description": "Returns current system information including platform, architecture, working directory, and available disk space.",
    "entrypoint": "src/system_info.ts",
    "testFile": "tests/system_info.test.ts",
    "status": "ACTIVE",
    "parameters": {},
    "telemetry": {
      "totalInvocations": 4,
      "successCount": 4,
      "failureCount": 0,
      "avgDurationMs": 9.25,
      "healthScore": 1,
      "lastExecutedAt": "2026-09-11T19:05:50.221Z"
    },
    "createdAt": "2026-09-10T14:02:23.266Z",
    "updatedAt": "2026-09-11T19:05:50.221Z"
  },
  {
    "id": "53c2c017-3cfc-42ad-8a04-61beebe40658",
    "name": "hello_world",
    "version": "1.0.0",
    "description": "A simple tool that returns a greeting message with the current timestamp.",
    "entrypoint": "src/hello_world.ts",
    "testFile": "tests/hello_world.test.ts",
    "status": "ACTIVE",
    "parameters": {
      "name": "Name to greet"
    },
    "telemetry": {
      "totalInvocations": 5,
      "successCount": 5,
      "failureCount": 0,
      "avgDurationMs": 0.2,
      "healthScore": 1,
      "lastExecutedAt": "2026-09-11T19:05:50.188Z"
    },
    "createdAt": "2026-09-10T14:03:16.910Z",
    "updatedAt": "2026-09-11T19:05:50.188Z"
  },
  {
    "id": "9050eea0-69a5-4033-88b4-2c75f32b9bbc",
    "name": "word_count",
    "version": "1.0.0",
    "description": "Counts words, characters, and lines in a given text string, returning structured statistics.",
    "entrypoint": "src/word_count.ts",
    "testFile": "tests/word_count.test.ts",
    "status": "ACTIVE",
    "parameters": {
      "text": "The text to analyze. Empty strings are allowed and return zero counts."
    },
    "telemetry": {
      "totalInvocations": 2,
      "successCount": 2,
      "failureCount": 0,
      "avgDurationMs": 3,
      "healthScore": 1,
      "lastExecutedAt": "2026-09-11T19:06:26.044Z"
    },
    "createdAt": "2026-09-11T19:06:24.757Z",
    "updatedAt": "2026-09-11T19:06:26.044Z"
  },
  {
    "id": "6a24c935-7b67-4f57-9a41-613a693036d3",
    "name": "fibonacci",
    "version": "1.0.0",
    "description": "Computes the nth Fibonacci number (F(0)=0, F(1)=1) using an iterative algorithm with BigInt to avoid overflow, optionally returning the full sequence up to n.",
    "entrypoint": "src/fibonacci.ts",
    "testFile": "tests/fibonacci.test.ts",
    "status": "ACTIVE",
    "parameters": {
      "n": "Zero-based index of the Fibonacci number to compute (0..1000).",
      "fullSequence": "When true, also returns the entire sequence from F(0) through F(n)."
    },
    "telemetry": {
      "totalInvocations": 6,
      "successCount": 6,
      "failureCount": 0,
      "avgDurationMs": 2.17,
      "healthScore": 1,
      "lastExecutedAt": "2026-09-11T19:07:59.653Z"
    },
    "createdAt": "2026-09-11T19:07:25.352Z",
    "updatedAt": "2026-09-11T19:07:59.653Z"
  }
]